{"analysis":{"algorithm_sha256":"aaaaaaaaaaaaaaaaaaaaaaaaaaaaaaaaaaaaaaaaaaaaaaaaaaaaaaaaaaaaaaaa","analysis_id":"analysis2-03e3a59c02d52c549c7e2f20f38b19c058f254f1327a49ad208f7f0a33592f06","analysis_sha256":"03e3a59c02d52c549c7e2f20f38b19c058f254f1327a49ad208f7f0a33592f06","extractor_id":"transition-local-features","extractor_version":"2.0.0"},"incoming":{"cues":[{"confidence_ppm":800000,"cue_id":"cue1-1a826ea3e8c79526990bc31270f65a58a9af0ca2eb79a23dea21f78f8bc075b9","kind":"intro","source_frame":800000}],"sample_peak_mdbfs":-3000,"source_frames":2646000,"source_pcm_sha256":"2222222222222222222222222222222222222222222222222222222222222222","true_peak_mdbtp":-2500,"windows":[{"bass_occupancy_ppm":350000,"end_frame":1064600,"energy_variability_mdb":1100,"hard_cut_safe":true,"high_occupancy_ppm":520000,"kind":"incoming_transition","low_occupancy_ppm":230000,"mid_occupancy_ppm":250000,"short_term_loudness_mlu":-8000,"spectral_stability_ppm":730000,"start_frame":94400,"transient_activity_ppm":500000,"transient_density_ppm":150000,"window_id":"window1-f2563f0e4bde60140d371d9e04e6c81d6a76c6a49fc185f9021321c2786e8edf"}]},"outgoing":{"cues":[{"confidence_ppm":800000,"cue_id":"cue1-aeb2bbf28c240d54d4a588726e9e13a72e75e6ae27f1ebf8048df45434078d62","kind":"outro","source_frame":2000000}],"rhythm":{"beat_confidence_ppm":850000,"beat_frames":[1900000,1922050,1944100,1966150,1988200],"downbeat_confidence_ppm":750000,"downbeat_frames":[1900000,1988200],"meter_beats":4,"tempo_millibpm":120000},"sample_peak_mdbfs":-2000,"source_frames":2646000,"source_pcm_sha256":"1111111111111111111111111111111111111111111111111111111111111111","true_peak_mdbtp":-1500,"windows":[{"bass_occupancy_ppm":420000,"end_frame":2264600,"energy_variability_mdb":1200,"hard_cut_safe":true,"high_occupancy_ppm":580000,"kind":"outgoing_transition","low_occupancy_ppm":180000,"mid_occupancy_ppm":240000,"short_term_loudness_mlu":-11000,"spectral_stability_ppm":710000,"start_frame":1294400,"transient_activity_ppm":700000,"transient_density_ppm":250000,"window_id":"window1-d8b8efb9887cf9de07fd05279fc7c4bc1da51286b97212511bde511a146a6a29"}]},"pair":{"alignment_error_ppm_of_beat":20000,"bass_collision_ppm":500000,"energy_delta_mdb":3000,"incoming_cue_id":"cue1-1a826ea3e8c79526990bc31270f65a58a9af0ca2eb79a23dea21f78f8bc075b9","incoming_window_id":"window1-f2563f0e4bde60140d371d9e04e6c81d6a76c6a49fc185f9021321c2786e8edf","outgoing_cue_id":"cue1-aeb2bbf28c240d54d4a588726e9e13a72e75e6ae27f1ebf8048df45434078d62","outgoing_window_id":"window1-d8b8efb9887cf9de07fd05279fc7c4bc1da51286b97212511bde511a146a6a29","spectral_overlap_ppm":700000,"transient_collision_ppm":450000,"transient_collision_span_frames":22050},"schema_version":"transition-feature-snapshot/2","snapshot_sha256":"f71d6b2893defb699d37930794cd5bc03c571ef0e41c752900748cb94b301ec5"}
